{
  "$schema": "../../../../schemas/content-coalition.schema.json",
  "schemaVersion": 1,
  "intro": "כאן אפשר לנסות צירופים של רשימות ולראות שני דברים: אם יש להן יחד {{majority}} מנדטים, והאם הצירוף סותר משהו שהרשימות עצמן אמרו. זה כלי הסבר והדמיה. הוא לא חוזה מה יקרה, לא מדרג צירופים ולא ממליץ על ממשלה. הלשונית לא משתמשת בתשובות שלך בשאלון ולא משנה אותן.",
  "banNotice": "<b>תקופת איסור פרסום סקרים</b> (מסוף יום שישי {{banEve}} ועד סגירת הקלפיות). בתקופה הזו העמוד לא טוען מספרי סקרים. הזינו את המנדטים בעצמכם.",
  "pollsNote": "המנדטים בפתיחה הם חציון בתי הסקרים במאגר \"{{sourceName}}\" (סקרים מ-{{pollsFrom}} עד {{pollsTo}}, {{pollsLink}}). חציון של חצי מנדט מעוגל כלפי מטה. ליד כל רשימה מופיעים החציון והטווח. מתחילת איסור פרסום הסקרים, {{banFrom}}, העמוד לא יטען מספרי סקרים.",
  "matrixIntro": "חמש דרגות, רק לפי הצהרה או מעשה מתועדים עם מקור ותאריך. בלי מקור הערך הוא \"לא ידוע\". עמדה לא נגזרת מאידיאולוגיה, מגוש או מהצבעה בנושא אחר, ודברים של מועמד שלא דיבר בשם הרשימה לא נחשבים עמדת הרשימה. הסימון לא סימטרי: מה שרשימה א' אמרה על ב' לא אומר דבר על מה ש-ב' אמרה על א'. \"מפלגות ערביות\" ו\"מפלגות חרדיות\" הם כינויים של הדוברים עצמם. המאגר משייך אותם לרע\"ם ולרשימה המשותפת, ולש\"ס וליהדות התורה.",
  "outAbout": "תמיכה מבחוץ של מפלגות ערביות",
  "supNote": "{{list}} מסומנת כתמיכה מבחוץ. במאגר יש שאלה על תמיכה מבחוץ רק לגבי מפלגות ערביות, ולכן התמיכה הזו לא נבדקה מול הצהרות.",
  "govLabel": "ממשלות מאז 2020:",
  "sourcesNote": "הצהרות ונתונים מקובץ הנתונים של המאגר \"{{sourceName}}\" (נבנה ב-{{srcBuilt}}, טביעת SHA-256 של הקובץ: <span dir=\"ltr\">{{srcShaShort}}…</span>). הצהרות שסומנו \"לא מהמאגר\" נבדקו במקור הראשוני. פרטים בלשונית \"שיטה ומקורות\".",
  "vars": { "rotationNote": ", הכנסת שנבחרת עכשיו" }
}
